No.     Length Time           Source                Destination           Protocol Info
    189 166    10.912623      192.168.122.199       192.168.0.106         OpenFlow Type: OFPT_PACKET_IN

Frame 189: 166 bytes on wire (1328 bits), 166 bytes captured (1328 bits) on interface -, id 0
Ethernet II, Src: 22:68:96:5f:e6:ec (22:68:96:5f:e6:ec), Dst: RealtekU_84:f7:c5 (52:54:00:84:f7:c5)
Internet Protocol Version 4, Src: 192.168.122.199, Dst: 192.168.0.106
Transmission Control Protocol, Src Port: 41516, Dst Port: 6653, Seq: 4413, Ack: 11745, Len: 112
OpenFlow 1.3
    Version: 1.3 (0x04)
    Type: OFPT_PACKET_IN (10)
    Length: 112
    Transaction ID: 0
    Buffer ID: OFP_NO_BUFFER (4294967295)
    Total length: 70
    Reason: OFPR_ACTION (1)
    Table ID: 0
    Cookie: 0x000100007284f554
    Match
    Pad: 0000
    Data
        Ethernet II, Src: 82:bd:2a:fa:68:08 (82:bd:2a:fa:68:08), Dst: IPv6mcast_02 (33:33:00:00:00:02)
        Internet Protocol Version 6, Src: fe80::80bd:2aff:fefa:6808, Dst: ff02::2
        Internet Control Message Protocol v6
            Type: Router Solicitation (133)
            Code: 0
            Checksum: 0x53ae [correct]
            [Checksum Status: Good]
            Reserved: 00000000
            ICMPv6 Option (Source link-layer address : 82:bd:2a:fa:68:08)

No.     Length Time           Source                Destination           Protocol Info
    191 492    10.917424      192.168.0.106         192.168.122.199       OpenFlow Type: OFPT_BARRIER_REQUEST

Frame 191: 492 bytes on wire (3936 bits), 492 bytes captured (3936 bits) on interface -, id 0
Ethernet II, Src: RealtekU_84:f7:c5 (52:54:00:84:f7:c5), Dst: 22:68:96:5f:e6:ec (22:68:96:5f:e6:ec)
Internet Protocol Version 4, Src: 192.168.0.106, Dst: 192.168.122.199
Transmission Control Protocol, Src Port: 6653, Dst Port: 41516, Seq: 11745, Ack: 4525, Len: 438
OpenFlow 1.3
    Version: 1.3 (0x04)
    Type: OFPT_PACKET_OUT (13)
    Length: 110
    Transaction ID: 0
    Buffer ID: OFP_NO_BUFFER (4294967295)
    In port: 1
    Actions length: 16
    Pad: 000000000000
    Action
    Data
        Ethernet II, Src: 82:bd:2a:fa:68:08 (82:bd:2a:fa:68:08), Dst: IPv6mcast_02 (33:33:00:00:00:02)
        Internet Protocol Version 6, Src: fe80::80bd:2aff:fefa:6808, Dst: ff02::2
        Internet Control Message Protocol v6
            Type: Router Solicitation (133)
            Code: 0
            Checksum: 0x53ae [correct]
            [Checksum Status: Good]
            Reserved: 00000000
            ICMPv6 Option (Source link-layer address : 82:bd:2a:fa:68:08)
OpenFlow 1.3
    Version: 1.3 (0x04)
    Type: OFPT_FLOW_MOD (14)
    Length: 96
    Transaction ID: 1049537
    Cookie: 0x000100002f82665b
    Cookie mask: 0x0000000000000000
    Table ID: 0
    Command: OFPFC_ADD (0)
    Idle timeout: 0
    Hard timeout: 0
    Priority: 40000
    Buffer ID: OFP_NO_BUFFER (4294967295)
    Out port: OFPP_ANY (4294967295)
    Out group: OFPG_ANY (4294967295)
    Flags: 0x0001
    Pad: 0000
    Match
    Instruction
    Instruction
OpenFlow 1.3
    Version: 1.3 (0x04)
    Type: OFPT_BARRIER_REQUEST (20)
    Length: 8
    Transaction ID: 1049537
OpenFlow 1.3
    Version: 1.3 (0x04)
    Type: OFPT_FLOW_MOD (14)
    Length: 104
    Transaction ID: 1049538
    Cookie: 0x0001000070a66c59
    Cookie mask: 0x0000000000000000
    Table ID: 0
    Command: OFPFC_ADD (0)
    Idle timeout: 0
    Hard timeout: 0
    Priority: 40000
    Buffer ID: OFP_NO_BUFFER (4294967295)
    Out port: OFPP_ANY (4294967295)
    Out group: OFPG_ANY (4294967295)
    Flags: 0x0001
    Pad: 0000
    Match
    Instruction
    Instruction
OpenFlow 1.3
    Version: 1.3 (0x04)
    Type: OFPT_BARRIER_REQUEST (20)
    Length: 8
    Transaction ID: 1049538
OpenFlow 1.3
    Version: 1.3 (0x04)
    Type: OFPT_FLOW_MOD (14)
    Length: 104
    Transaction ID: 1049539
    Cookie: 0x00010000075600e7
    Cookie mask: 0x0000000000000000
    Table ID: 0
    Command: OFPFC_ADD (0)
    Idle timeout: 0
    Hard timeout: 0
    Priority: 40000
    Buffer ID: OFP_NO_BUFFER (4294967295)
    Out port: OFPP_ANY (4294967295)
    Out group: OFPG_ANY (4294967295)
    Flags: 0x0001
    Pad: 0000
    Match
    Instruction
    Instruction
OpenFlow 1.3
    Version: 1.3 (0x04)
    Type: OFPT_BARRIER_REQUEST (20)
    Length: 8
    Transaction ID: 1049539

No.     Length Time           Source                Destination           Protocol Info
    198 166    11.172487      192.168.122.199       192.168.0.106         OpenFlow Type: OFPT_PACKET_IN

Frame 198: 166 bytes on wire (1328 bits), 166 bytes captured (1328 bits) on interface -, id 0
Ethernet II, Src: 22:68:96:5f:e6:ec (22:68:96:5f:e6:ec), Dst: RealtekU_84:f7:c5 (52:54:00:84:f7:c5)
Internet Protocol Version 4, Src: 192.168.122.199, Dst: 192.168.0.106
Transmission Control Protocol, Src Port: 41516, Dst Port: 6653, Seq: 4549, Ack: 12183, Len: 112
OpenFlow 1.3
    Version: 1.3 (0x04)
    Type: OFPT_PACKET_IN (10)
    Length: 112
    Transaction ID: 0
    Buffer ID: OFP_NO_BUFFER (4294967295)
    Total length: 70
    Reason: OFPR_ACTION (1)
    Table ID: 0
    Cookie: 0x000100007284f554
    Match
    Pad: 0000
    Data
        Ethernet II, Src: 36:16:9a:cb:44:18 (36:16:9a:cb:44:18), Dst: IPv6mcast_02 (33:33:00:00:00:02)
        Internet Protocol Version 6, Src: fe80::3416:9aff:fecb:4418, Dst: ff02::2
        Internet Control Message Protocol v6
            Type: Router Solicitation (133)
            Code: 0
            Checksum: 0x553a [correct]
            [Checksum Status: Good]
            Reserved: 00000000
            ICMPv6 Option (Source link-layer address : 36:16:9a:cb:44:18)

No.     Length Time           Source                Destination           Protocol Info
    200 164    11.173728      192.168.0.106         192.168.122.199       OpenFlow Type: OFPT_PACKET_OUT

Frame 200: 164 bytes on wire (1312 bits), 164 bytes captured (1312 bits) on interface -, id 0
Ethernet II, Src: RealtekU_84:f7:c5 (52:54:00:84:f7:c5), Dst: 22:68:96:5f:e6:ec (22:68:96:5f:e6:ec)
Internet Protocol Version 4, Src: 192.168.0.106, Dst: 192.168.122.199
Transmission Control Protocol, Src Port: 6653, Dst Port: 41516, Seq: 12183, Ack: 4661, Len: 110
OpenFlow 1.3
    Version: 1.3 (0x04)
    Type: OFPT_PACKET_OUT (13)
    Length: 110
    Transaction ID: 0
    Buffer ID: OFP_NO_BUFFER (4294967295)
    In port: 3
    Actions length: 16
    Pad: 000000000000
    Action
    Data
        Ethernet II, Src: 36:16:9a:cb:44:18 (36:16:9a:cb:44:18), Dst: IPv6mcast_02 (33:33:00:00:00:02)
        Internet Protocol Version 6, Src: fe80::3416:9aff:fecb:4418, Dst: ff02::2
        Internet Control Message Protocol v6
            Type: Router Solicitation (133)
            Code: 0
            Checksum: 0x553a [correct]
            [Checksum Status: Good]
            Reserved: 00000000
            ICMPv6 Option (Source link-layer address : 36:16:9a:cb:44:18)

No.     Length Time           Source                Destination           Protocol Info
    315 186    13.700774      192.168.122.199       192.168.0.106         OpenFlow Type: OFPT_PACKET_IN

Frame 315: 186 bytes on wire (1488 bits), 186 bytes captured (1488 bits) on interface -, id 0
Ethernet II, Src: 22:68:96:5f:e6:ec (22:68:96:5f:e6:ec), Dst: RealtekU_84:f7:c5 (52:54:00:84:f7:c5)
Internet Protocol Version 4, Src: 192.168.122.199, Dst: 192.168.0.106
Transmission Control Protocol, Src Port: 41516, Dst Port: 6653, Seq: 14253, Ack: 12453, Len: 132
OpenFlow 1.3
    Version: 1.3 (0x04)
    Type: OFPT_PACKET_IN (10)
    Length: 132
    Transaction ID: 0
    Buffer ID: OFP_NO_BUFFER (4294967295)
    Total length: 90
    Reason: OFPR_ACTION (1)
    Table ID: 0
    Cookie: 0x0001000036f0d025
    Match
    Pad: 0000
    Data
        Ethernet II, Src: ca:02:05:e6:00:08 (ca:02:05:e6:00:08), Dst: IPv6mcast_16 (33:33:00:00:00:16)
        Internet Protocol Version 6, Src: ::, Dst: ff02::16
        Internet Control Message Protocol v6
            Type: Multicast Listener Report Message v2 (143)
            Code: 0
            Checksum: 0x6e8a [correct]
            [Checksum Status: Good]
            Reserved: 0000
            Number of Multicast Address Records: 1
            Multicast Address Record Changed to exclude: ff02::2

No.     Length Time           Source                Destination           Protocol Info
    316 186    13.701141      192.168.122.199       192.168.0.106         OpenFlow Type: OFPT_PACKET_IN

Frame 316: 186 bytes on wire (1488 bits), 186 bytes captured (1488 bits) on interface -, id 0
Ethernet II, Src: 22:68:96:5f:e6:ec (22:68:96:5f:e6:ec), Dst: RealtekU_84:f7:c5 (52:54:00:84:f7:c5)
Internet Protocol Version 4, Src: 192.168.122.199, Dst: 192.168.0.106
Transmission Control Protocol, Src Port: 41516, Dst Port: 6653, Seq: 14385, Ack: 12453, Len: 132
OpenFlow 1.3
    Version: 1.3 (0x04)
    Type: OFPT_PACKET_IN (10)
    Length: 132
    Transaction ID: 0
    Buffer ID: OFP_NO_BUFFER (4294967295)
    Total length: 90
    Reason: OFPR_ACTION (1)
    Table ID: 0
    Cookie: 0x0001000036f0d025
    Match
    Pad: 0000
    Data
        Ethernet II, Src: ca:02:05:e6:00:08 (ca:02:05:e6:00:08), Dst: IPv6mcast_16 (33:33:00:00:00:16)
        Internet Protocol Version 6, Src: ::, Dst: ff02::16
        Internet Control Message Protocol v6
            Type: Multicast Listener Report Message v2 (143)
            Code: 0
            Checksum: 0x6f86 [correct]
            [Checksum Status: Good]
            Reserved: 0000
            Number of Multicast Address Records: 1
            Multicast Address Record Changed to exclude: ff02::1:ff00:4

No.     Length Time           Source                Destination           Protocol Info
    320 314    13.703559      192.168.0.106         192.168.122.199       OpenFlow Type: OFPT_PACKET_OUT

Frame 320: 314 bytes on wire (2512 bits), 314 bytes captured (2512 bits) on interface -, id 0
Ethernet II, Src: RealtekU_84:f7:c5 (52:54:00:84:f7:c5), Dst: 22:68:96:5f:e6:ec (22:68:96:5f:e6:ec)
Internet Protocol Version 4, Src: 192.168.0.106, Dst: 192.168.122.199
Transmission Control Protocol, Src Port: 6653, Dst Port: 41516, Seq: 12453, Ack: 14517, Len: 260
OpenFlow 1.3
    Version: 1.3 (0x04)
    Type: OFPT_PACKET_OUT (13)
    Length: 130
    Transaction ID: 0
    Buffer ID: OFP_NO_BUFFER (4294967295)
    In port: 4
    Actions length: 16
    Pad: 000000000000
    Action
    Data
        Ethernet II, Src: ca:02:05:e6:00:08 (ca:02:05:e6:00:08), Dst: IPv6mcast_16 (33:33:00:00:00:16)
        Internet Protocol Version 6, Src: ::, Dst: ff02::16
        Internet Control Message Protocol v6
            Type: Multicast Listener Report Message v2 (143)
            Code: 0
            Checksum: 0x6e8a [correct]
            [Checksum Status: Good]
            Reserved: 0000
            Number of Multicast Address Records: 1
            Multicast Address Record Changed to exclude: ff02::2
OpenFlow 1.3
    Version: 1.3 (0x04)
    Type: OFPT_PACKET_OUT (13)
    Length: 130
    Transaction ID: 0
    Buffer ID: OFP_NO_BUFFER (4294967295)
    In port: 4
    Actions length: 16
    Pad: 000000000000
    Action
    Data
        Ethernet II, Src: ca:02:05:e6:00:08 (ca:02:05:e6:00:08), Dst: IPv6mcast_16 (33:33:00:00:00:16)
        Internet Protocol Version 6, Src: ::, Dst: ff02::16
        Internet Control Message Protocol v6
            Type: Multicast Listener Report Message v2 (143)
            Code: 0
            Checksum: 0x6f86 [correct]
            [Checksum Status: Good]
            Reserved: 0000
            Number of Multicast Address Records: 1
            Multicast Address Record Changed to exclude: ff02::1:ff00:4

No.     Length Time           Source                Destination           Protocol Info
    321 186    13.704578      192.168.122.171       192.168.0.106         OpenFlow Type: OFPT_PACKET_IN

Frame 321: 186 bytes on wire (1488 bits), 186 bytes captured (1488 bits) on interface -, id 0
Ethernet II, Src: 5a:5d:f1:21:d4:db (5a:5d:f1:21:d4:db), Dst: RealtekU_84:f7:c5 (52:54:00:84:f7:c5)
Internet Protocol Version 4, Src: 192.168.122.171, Dst: 192.168.0.106
Transmission Control Protocol, Src Port: 36600, Dst Port: 6653, Seq: 4437, Ack: 12073, Len: 132
OpenFlow 1.3
    Version: 1.3 (0x04)
    Type: OFPT_PACKET_IN (10)
    Length: 132
    Transaction ID: 0
    Buffer ID: OFP_NO_BUFFER (4294967295)
    Total length: 90
    Reason: OFPR_ACTION (1)
    Table ID: 0
    Cookie: 0x00010000f0839d11
    Match
    Pad: 0000
    Data
        Ethernet II, Src: ca:02:05:e6:00:08 (ca:02:05:e6:00:08), Dst: IPv6mcast_16 (33:33:00:00:00:16)
        Internet Protocol Version 6, Src: ::, Dst: ff02::16
        Internet Control Message Protocol v6
            Type: Multicast Listener Report Message v2 (143)
            Code: 0
            Checksum: 0x6e8a [correct]
            [Checksum Status: Good]
            Reserved: 0000
            Number of Multicast Address Records: 1
            Multicast Address Record Changed to exclude: ff02::2

No.     Length Time           Source                Destination           Protocol Info
    322 186    13.705001      192.168.122.171       192.168.0.106         OpenFlow Type: OFPT_PACKET_IN

Frame 322: 186 bytes on wire (1488 bits), 186 bytes captured (1488 bits) on interface -, id 0
Ethernet II, Src: 5a:5d:f1:21:d4:db (5a:5d:f1:21:d4:db), Dst: RealtekU_84:f7:c5 (52:54:00:84:f7:c5)
Internet Protocol Version 4, Src: 192.168.122.171, Dst: 192.168.0.106
Transmission Control Protocol, Src Port: 36600, Dst Port: 6653, Seq: 4569, Ack: 12073, Len: 132
OpenFlow 1.3
    Version: 1.3 (0x04)
    Type: OFPT_PACKET_IN (10)
    Length: 132
    Transaction ID: 0
    Buffer ID: OFP_NO_BUFFER (4294967295)
    Total length: 90
    Reason: OFPR_ACTION (1)
    Table ID: 0
    Cookie: 0x00010000f0839d11
    Match
    Pad: 0000
    Data
        Ethernet II, Src: ca:02:05:e6:00:08 (ca:02:05:e6:00:08), Dst: IPv6mcast_16 (33:33:00:00:00:16)
        Internet Protocol Version 6, Src: ::, Dst: ff02::16
        Internet Control Message Protocol v6
            Type: Multicast Listener Report Message v2 (143)
            Code: 0
            Checksum: 0x6f86 [correct]
            [Checksum Status: Good]
            Reserved: 0000
            Number of Multicast Address Records: 1
            Multicast Address Record Changed to exclude: ff02::1:ff00:4

No.     Length Time           Source                Destination           Protocol Info
    325 314    13.706538      192.168.0.106         192.168.122.171       OpenFlow Type: OFPT_PACKET_OUT

Frame 325: 314 bytes on wire (2512 bits), 314 bytes captured (2512 bits) on interface -, id 0
Ethernet II, Src: RealtekU_84:f7:c5 (52:54:00:84:f7:c5), Dst: 5a:5d:f1:21:d4:db (5a:5d:f1:21:d4:db)
Internet Protocol Version 4, Src: 192.168.0.106, Dst: 192.168.122.171
Transmission Control Protocol, Src Port: 6653, Dst Port: 36600, Seq: 12073, Ack: 4701, Len: 260
OpenFlow 1.3
    Version: 1.3 (0x04)
    Type: OFPT_PACKET_OUT (13)
    Length: 130
    Transaction ID: 0
    Buffer ID: OFP_NO_BUFFER (4294967295)
    In port: 3
    Actions length: 16
    Pad: 000000000000
    Action
    Data
        Ethernet II, Src: ca:02:05:e6:00:08 (ca:02:05:e6:00:08), Dst: IPv6mcast_16 (33:33:00:00:00:16)
        Internet Protocol Version 6, Src: ::, Dst: ff02::16
        Internet Control Message Protocol v6
            Type: Multicast Listener Report Message v2 (143)
            Code: 0
            Checksum: 0x6e8a [correct]
            [Checksum Status: Good]
            Reserved: 0000
            Number of Multicast Address Records: 1
            Multicast Address Record Changed to exclude: ff02::2
OpenFlow 1.3
    Version: 1.3 (0x04)
    Type: OFPT_PACKET_OUT (13)
    Length: 130
    Transaction ID: 0
    Buffer ID: OFP_NO_BUFFER (4294967295)
    In port: 3
    Actions length: 16
    Pad: 000000000000
    Action
    Data
        Ethernet II, Src: ca:02:05:e6:00:08 (ca:02:05:e6:00:08), Dst: IPv6mcast_16 (33:33:00:00:00:16)
        Internet Protocol Version 6, Src: ::, Dst: ff02::16
        Internet Control Message Protocol v6
            Type: Multicast Listener Report Message v2 (143)
            Code: 0
            Checksum: 0x6f86 [correct]
            [Checksum Status: Good]
            Reserved: 0000
            Number of Multicast Address Records: 1
            Multicast Address Record Changed to exclude: ff02::1:ff00:4

No.     Length Time           Source                Destination           Protocol Info
    337 174    13.761659      192.168.122.199       192.168.0.106         OpenFlow Type: OFPT_PACKET_IN

Frame 337: 174 bytes on wire (1392 bits), 174 bytes captured (1392 bits) on interface -, id 0
Ethernet II, Src: 22:68:96:5f:e6:ec (22:68:96:5f:e6:ec), Dst: RealtekU_84:f7:c5 (52:54:00:84:f7:c5)
Internet Protocol Version 4, Src: 192.168.122.199, Dst: 192.168.0.106
Transmission Control Protocol, Src Port: 41516, Dst Port: 6653, Seq: 14517, Ack: 12713, Len: 120
OpenFlow 1.3
    Version: 1.3 (0x04)
    Type: OFPT_PACKET_IN (10)
    Length: 120
    Transaction ID: 0
    Buffer ID: OFP_NO_BUFFER (4294967295)
    Total length: 78
    Reason: OFPR_ACTION (1)
    Table ID: 0
    Cookie: 0x0001000070a66c59
    Match
    Pad: 0000
    Data
        Ethernet II, Src: ca:02:05:e6:00:08 (ca:02:05:e6:00:08), Dst: IPv6mcast_ff:e6:00:08 (33:33:ff:e6:00:08)
        Internet Protocol Version 6, Src: ::, Dst: ff02::1:ffe6:8
        Internet Control Message Protocol v6
            Type: Neighbor Solicitation (135)
            Code: 0
            Checksum: 0xae48 [correct]
            [Checksum Status: Good]
            Reserved: 00000000
            Target Address: fe80::c802:5ff:fee6:8

No.     Length Time           Source                Destination           Protocol Info
    338 174    13.762073      192.168.122.199       192.168.0.106         OpenFlow Type: OFPT_PACKET_IN

Frame 338: 174 bytes on wire (1392 bits), 174 bytes captured (1392 bits) on interface -, id 0
Ethernet II, Src: 22:68:96:5f:e6:ec (22:68:96:5f:e6:ec), Dst: RealtekU_84:f7:c5 (52:54:00:84:f7:c5)
Internet Protocol Version 4, Src: 192.168.122.199, Dst: 192.168.0.106
Transmission Control Protocol, Src Port: 41516, Dst Port: 6653, Seq: 14637, Ack: 12713, Len: 120
OpenFlow 1.3
    Version: 1.3 (0x04)
    Type: OFPT_PACKET_IN (10)
    Length: 120
    Transaction ID: 0
    Buffer ID: OFP_NO_BUFFER (4294967295)
    Total length: 78
    Reason: OFPR_ACTION (1)
    Table ID: 0
    Cookie: 0x0001000070a66c59
    Match
    Pad: 0000
    Data
        Ethernet II, Src: ca:02:05:e6:00:08 (ca:02:05:e6:00:08), Dst: IPv6mcast_ff:00:00:04 (33:33:ff:00:00:04)
        Internet Protocol Version 6, Src: ::, Dst: ff02::1:ff00:4
        Internet Control Message Protocol v6
            Type: Neighbor Solicitation (135)
            Code: 0
            Checksum: 0x7c1f [correct]
            [Checksum Status: Good]
            Reserved: 00000000
            Target Address: fe80::4

No.     Length Time           Source                Destination           Protocol Info
    341 1352   13.764909      192.168.0.106         192.168.122.199       OpenFlow Type: OFPT_PACKET_OUT

Frame 341: 1352 bytes on wire (10816 bits), 1352 bytes captured (10816 bits) on interface -, id 0
Ethernet II, Src: RealtekU_84:f7:c5 (52:54:00:84:f7:c5), Dst: 22:68:96:5f:e6:ec (22:68:96:5f:e6:ec)
Internet Protocol Version 4, Src: 192.168.0.106, Dst: 192.168.122.199
Transmission Control Protocol, Src Port: 6653, Dst Port: 41516, Seq: 12713, Ack: 14757, Len: 1298
OpenFlow 1.3
    Version: 1.3 (0x04)
    Type: OFPT_PACKET_OUT (13)
    Length: 118
    Transaction ID: 125424
    Buffer ID: OFP_NO_BUFFER (4294967295)
    In port: OFPP_CONTROLLER (4294967293)
    Actions length: 16
    Pad: 000000000000
    Action
    Data
        Ethernet II, Src: ca:02:05:e6:00:08 (ca:02:05:e6:00:08), Dst: IPv6mcast_ff:e6:00:08 (33:33:ff:e6:00:08)
        Internet Protocol Version 6, Src: ::, Dst: ff02::1:ffe6:8
        Internet Control Message Protocol v6
            Type: Neighbor Solicitation (135)
            Code: 0
            Checksum: 0xae48 [correct]
            [Checksum Status: Good]
            Reserved: 00000000
            Target Address: fe80::c802:5ff:fee6:8
OpenFlow 1.3
    Version: 1.3 (0x04)
    Type: OFPT_PACKET_OUT (13)
    Length: 118
    Transaction ID: 125425
    Buffer ID: OFP_NO_BUFFER (4294967295)
    In port: OFPP_CONTROLLER (4294967293)
    Actions length: 16
    Pad: 000000000000
    Action
    Data
        Ethernet II, Src: ca:02:05:e6:00:08 (ca:02:05:e6:00:08), Dst: IPv6mcast_ff:e6:00:08 (33:33:ff:e6:00:08)
        Internet Protocol Version 6, Src: ::, Dst: ff02::1:ffe6:8
        Internet Control Message Protocol v6
            Type: Neighbor Solicitation (135)
            Code: 0
            Checksum: 0xae48 [correct]
            [Checksum Status: Good]
            Reserved: 00000000
            Target Address: fe80::c802:5ff:fee6:8
OpenFlow 1.3
    Version: 1.3 (0x04)
    Type: OFPT_PACKET_OUT (13)
    Length: 118
    Transaction ID: 125426
    Buffer ID: OFP_NO_BUFFER (4294967295)
    In port: OFPP_CONTROLLER (4294967293)
    Actions length: 16
    Pad: 000000000000
    Action
    Data
        Ethernet II, Src: ca:02:05:e6:00:08 (ca:02:05:e6:00:08), Dst: IPv6mcast_ff:e6:00:08 (33:33:ff:e6:00:08)
        Internet Protocol Version 6, Src: ::, Dst: ff02::1:ffe6:8
        Internet Control Message Protocol v6
            Type: Neighbor Solicitation (135)
            Code: 0
            Checksum: 0xae48 [correct]
            [Checksum Status: Good]
            Reserved: 00000000
            Target Address: fe80::c802:5ff:fee6:8
OpenFlow 1.3
    Version: 1.3 (0x04)
    Type: OFPT_PACKET_OUT (13)
    Length: 118
    Transaction ID: 125427
    Buffer ID: OFP_NO_BUFFER (4294967295)
    In port: OFPP_CONTROLLER (4294967293)
    Actions length: 16
    Pad: 000000000000
    Action
    Data
        Ethernet II, Src: ca:02:05:e6:00:08 (ca:02:05:e6:00:08), Dst: IPv6mcast_ff:e6:00:08 (33:33:ff:e6:00:08)
        Internet Protocol Version 6, Src: ::, Dst: ff02::1:ffe6:8
        Internet Control Message Protocol v6
            Type: Neighbor Solicitation (135)
            Code: 0
            Checksum: 0xae48 [correct]
            [Checksum Status: Good]
            Reserved: 00000000
            Target Address: fe80::c802:5ff:fee6:8
OpenFlow 1.3
    Version: 1.3 (0x04)
    Type: OFPT_PACKET_OUT (13)
    Length: 118
    Transaction ID: 125428
    Buffer ID: OFP_NO_BUFFER (4294967295)
    In port: OFPP_CONTROLLER (4294967293)
    Actions length: 16
    Pad: 000000000000
    Action
    Data
        Ethernet II, Src: ca:02:05:e6:00:08 (ca:02:05:e6:00:08), Dst: IPv6mcast_ff:e6:00:08 (33:33:ff:e6:00:08)
        Internet Protocol Version 6, Src: ::, Dst: ff02::1:ffe6:8
        Internet Control Message Protocol v6
            Type: Neighbor Solicitation (135)
            Code: 0
            Checksum: 0xae48 [correct]
            [Checksum Status: Good]
            Reserved: 00000000
            Target Address: fe80::c802:5ff:fee6:8
OpenFlow 1.3
    Version: 1.3 (0x04)
    Type: OFPT_PACKET_OUT (13)
    Length: 118
    Transaction ID: 125429
    Buffer ID: OFP_NO_BUFFER (4294967295)
    In port: OFPP_CONTROLLER (4294967293)
    Actions length: 16
    Pad: 000000000000
    Action
    Data
        Ethernet II, Src: ca:02:05:e6:00:08 (ca:02:05:e6:00:08), Dst: IPv6mcast_ff:e6:00:08 (33:33:ff:e6:00:08)
        Internet Protocol Version 6, Src: ::, Dst: ff02::1:ffe6:8
        Internet Control Message Protocol v6
            Type: Neighbor Solicitation (135)
            Code: 0
            Checksum: 0xae48 [correct]
            [Checksum Status: Good]
            Reserved: 00000000
            Target Address: fe80::c802:5ff:fee6:8
OpenFlow 1.3
    Version: 1.3 (0x04)
    Type: OFPT_PACKET_OUT (13)
    Length: 118
    Transaction ID: 125430
    Buffer ID: OFP_NO_BUFFER (4294967295)
    In port: OFPP_CONTROLLER (4294967293)
    Actions length: 16
    Pad: 000000000000
    Action
    Data
        Ethernet II, Src: ca:02:05:e6:00:08 (ca:02:05:e6:00:08), Dst: IPv6mcast_ff:e6:00:08 (33:33:ff:e6:00:08)
        Internet Protocol Version 6, Src: ::, Dst: ff02::1:ffe6:8
        Internet Control Message Protocol v6
            Type: Neighbor Solicitation (135)
            Code: 0
            Checksum: 0xae48 [correct]
            [Checksum Status: Good]
            Reserved: 00000000
            Target Address: fe80::c802:5ff:fee6:8
OpenFlow 1.3
    Version: 1.3 (0x04)
    Type: OFPT_PACKET_OUT (13)
    Length: 118
    Transaction ID: 125431
    Buffer ID: OFP_NO_BUFFER (4294967295)
    In port: OFPP_CONTROLLER (4294967293)
    Actions length: 16
    Pad: 000000000000
    Action
    Data
        Ethernet II, Src: ca:02:05:e6:00:08 (ca:02:05:e6:00:08), Dst: IPv6mcast_ff:e6:00:08 (33:33:ff:e6:00:08)
        Internet Protocol Version 6, Src: ::, Dst: ff02::1:ffe6:8
        Internet Control Message Protocol v6
            Type: Neighbor Solicitation (135)
            Code: 0
            Checksum: 0xae48 [correct]
            [Checksum Status: Good]
            Reserved: 00000000
            Target Address: fe80::c802:5ff:fee6:8
OpenFlow 1.3
    Version: 1.3 (0x04)
    Type: OFPT_PACKET_OUT (13)
    Length: 118
    Transaction ID: 125432
    Buffer ID: OFP_NO_BUFFER (4294967295)
    In port: OFPP_CONTROLLER (4294967293)
    Actions length: 16
    Pad: 000000000000
    Action
    Data
        Ethernet II, Src: ca:02:05:e6:00:08 (ca:02:05:e6:00:08), Dst: IPv6mcast_ff:e6:00:08 (33:33:ff:e6:00:08)
        Internet Protocol Version 6, Src: ::, Dst: ff02::1:ffe6:8
        Internet Control Message Protocol v6
            Type: Neighbor Solicitation (135)
            Code: 0
            Checksum: 0xae48 [correct]
            [Checksum Status: Good]
            Reserved: 00000000
            Target Address: fe80::c802:5ff:fee6:8
OpenFlow 1.3
    Version: 1.3 (0x04)
    Type: OFPT_PACKET_OUT (13)
    Length: 118
    Transaction ID: 125433
    Buffer ID: OFP_NO_BUFFER (4294967295)
    In port: OFPP_CONTROLLER (4294967293)
    Actions length: 16
    Pad: 000000000000
    Action
    Data
        Ethernet II, Src: ca:02:05:e6:00:08 (ca:02:05:e6:00:08), Dst: IPv6mcast_ff:e6:00:08 (33:33:ff:e6:00:08)
        Internet Protocol Version 6, Src: ::, Dst: ff02::1:ffe6:8
        Internet Control Message Protocol v6
            Type: Neighbor Solicitation (135)
            Code: 0
            Checksum: 0xae48 [correct]
            [Checksum Status: Good]
            Reserved: 00000000
            Target Address: fe80::c802:5ff:fee6:8
OpenFlow 1.3
    Version: 1.3 (0x04)
    Type: OFPT_PACKET_OUT (13)
    Length: 118
    Transaction ID: 125434
    Buffer ID: OFP_NO_BUFFER (4294967295)
    In port: OFPP_CONTROLLER (4294967293)
    Actions length: 16
    Pad: 000000000000
    Action
    Data
        Ethernet II, Src: ca:02:05:e6:00:08 (ca:02:05:e6:00:08), Dst: IPv6mcast_ff:e6:00:08 (33:33:ff:e6:00:08)
        Internet Protocol Version 6, Src: ::, Dst: ff02::1:ffe6:8
        Internet Control Message Protocol v6
            Type: Neighbor Solicitation (135)
            Code: 0
            Checksum: 0xae48 [correct]
            [Checksum Status: Good]
            Reserved: 00000000
            Target Address: fe80::c802:5ff:fee6:8

No.     Length Time           Source                Destination           Protocol Info
    343 290    13.765267      192.168.0.106         192.168.122.199       OpenFlow Type: OFPT_PACKET_OUT

Frame 343: 290 bytes on wire (2320 bits), 290 bytes captured (2320 bits) on interface -, id 0
Ethernet II, Src: RealtekU_84:f7:c5 (52:54:00:84:f7:c5), Dst: 22:68:96:5f:e6:ec (22:68:96:5f:e6:ec)
Internet Protocol Version 4, Src: 192.168.0.106, Dst: 192.168.122.199
Transmission Control Protocol, Src Port: 6653, Dst Port: 41516, Seq: 14011, Ack: 14757, Len: 236
OpenFlow 1.3
    Version: 1.3 (0x04)
    Type: OFPT_PACKET_OUT (13)
    Length: 118
    Transaction ID: 125435
    Buffer ID: OFP_NO_BUFFER (4294967295)
    In port: OFPP_CONTROLLER (4294967293)
    Actions length: 16
    Pad: 000000000000
    Action
    Data
        Ethernet II, Src: ca:02:05:e6:00:08 (ca:02:05:e6:00:08), Dst: IPv6mcast_ff:e6:00:08 (33:33:ff:e6:00:08)
        Internet Protocol Version 6, Src: ::, Dst: ff02::1:ffe6:8
        Internet Control Message Protocol v6
            Type: Neighbor Solicitation (135)
            Code: 0
            Checksum: 0xae48 [correct]
            [Checksum Status: Good]
            Reserved: 00000000
            Target Address: fe80::c802:5ff:fee6:8
OpenFlow 1.3
    Version: 1.3 (0x04)
    Type: OFPT_PACKET_OUT (13)
    Length: 118
    Transaction ID: 125436
    Buffer ID: OFP_NO_BUFFER (4294967295)
    In port: OFPP_CONTROLLER (4294967293)
    Actions length: 16
    Pad: 000000000000
    Action
    Data
        Ethernet II, Src: ca:02:05:e6:00:08 (ca:02:05:e6:00:08), Dst: IPv6mcast_ff:e6:00:08 (33:33:ff:e6:00:08)
        Internet Protocol Version 6, Src: ::, Dst: ff02::1:ffe6:8
        Internet Control Message Protocol v6
            Type: Neighbor Solicitation (135)
            Code: 0
            Checksum: 0xae48 [correct]
            [Checksum Status: Good]
            Reserved: 00000000
            Target Address: fe80::c802:5ff:fee6:8

No.     Length Time           Source                Destination           Protocol Info
    345 408    13.765623      192.168.0.106         192.168.122.199       OpenFlow Type: OFPT_PACKET_OUT

Frame 345: 408 bytes on wire (3264 bits), 408 bytes captured (3264 bits) on interface -, id 0
Ethernet II, Src: RealtekU_84:f7:c5 (52:54:00:84:f7:c5), Dst: 22:68:96:5f:e6:ec (22:68:96:5f:e6:ec)
Internet Protocol Version 4, Src: 192.168.0.106, Dst: 192.168.122.199
Transmission Control Protocol, Src Port: 6653, Dst Port: 41516, Seq: 14247, Ack: 14757, Len: 354
OpenFlow 1.3
    Version: 1.3 (0x04)
    Type: OFPT_PACKET_OUT (13)
    Length: 118
    Transaction ID: 125451
    Buffer ID: OFP_NO_BUFFER (4294967295)
    In port: OFPP_CONTROLLER (4294967293)
    Actions length: 16
    Pad: 000000000000
    Action
    Data
        Ethernet II, Src: ca:02:05:e6:00:08 (ca:02:05:e6:00:08), Dst: IPv6mcast_ff:00:00:04 (33:33:ff:00:00:04)
        Internet Protocol Version 6, Src: ::, Dst: ff02::1:ff00:4
        Internet Control Message Protocol v6
            Type: Neighbor Solicitation (135)
            Code: 0
            Checksum: 0x7c1f [correct]
            [Checksum Status: Good]
            Reserved: 00000000
            Target Address: fe80::4
OpenFlow 1.3
    Version: 1.3 (0x04)
    Type: OFPT_PACKET_OUT (13)
    Length: 118
    Transaction ID: 125452
    Buffer ID: OFP_NO_BUFFER (4294967295)
    In port: OFPP_CONTROLLER (4294967293)
    Actions length: 16
    Pad: 000000000000
    Action
    Data
        Ethernet II, Src: ca:02:05:e6:00:08 (ca:02:05:e6:00:08), Dst: IPv6mcast_ff:00:00:04 (33:33:ff:00:00:04)
        Internet Protocol Version 6, Src: ::, Dst: ff02::1:ff00:4
        Internet Control Message Protocol v6
            Type: Neighbor Solicitation (135)
            Code: 0
            Checksum: 0x7c1f [correct]
            [Checksum Status: Good]
            Reserved: 00000000
            Target Address: fe80::4
OpenFlow 1.3
    Version: 1.3 (0x04)
    Type: OFPT_PACKET_OUT (13)
    Length: 118
    Transaction ID: 125453
    Buffer ID: OFP_NO_BUFFER (4294967295)
    In port: OFPP_CONTROLLER (4294967293)
    Actions length: 16
    Pad: 000000000000
    Action
    Data
        Ethernet II, Src: ca:02:05:e6:00:08 (ca:02:05:e6:00:08), Dst: IPv6mcast_ff:00:00:04 (33:33:ff:00:00:04)
        Internet Protocol Version 6, Src: ::, Dst: ff02::1:ff00:4
        Internet Control Message Protocol v6
            Type: Neighbor Solicitation (135)
            Code: 0
            Checksum: 0x7c1f [correct]
            [Checksum Status: Good]
            Reserved: 00000000
            Target Address: fe80::4

No.     Length Time           Source                Destination           Protocol Info
    346 1514   13.765745      192.168.0.106         192.168.122.171       OpenFlow Type: OFPT_PACKET_OUT

Frame 346: 1514 bytes on wire (12112 bits), 1514 bytes captured (12112 bits) on interface -, id 0
Ethernet II, Src: RealtekU_84:f7:c5 (52:54:00:84:f7:c5), Dst: 5a:5d:f1:21:d4:db (5a:5d:f1:21:d4:db)
Internet Protocol Version 4, Src: 192.168.0.106, Dst: 192.168.122.171
Transmission Control Protocol, Src Port: 6653, Dst Port: 36600, Seq: 12333, Ack: 4701, Len: 1460
OpenFlow 1.3
    Version: 1.3 (0x04)
    Type: OFPT_PACKET_OUT (13)
    Length: 118
    Transaction ID: 125410
    Buffer ID: OFP_NO_BUFFER (4294967295)
    In port: OFPP_CONTROLLER (4294967293)
    Actions length: 16
    Pad: 000000000000
    Action
    Data
        Ethernet II, Src: ca:02:05:e6:00:08 (ca:02:05:e6:00:08), Dst: IPv6mcast_ff:e6:00:08 (33:33:ff:e6:00:08)
        Internet Protocol Version 6, Src: ::, Dst: ff02::1:ffe6:8
        Internet Control Message Protocol v6
            Type: Neighbor Solicitation (135)
            Code: 0
            Checksum: 0xae48 [correct]
            [Checksum Status: Good]
            Reserved: 00000000
            Target Address: fe80::c802:5ff:fee6:8
OpenFlow 1.3
    Version: 1.3 (0x04)
    Type: OFPT_PACKET_OUT (13)
    Length: 118
    Transaction ID: 125411
    Buffer ID: OFP_NO_BUFFER (4294967295)
    In port: OFPP_CONTROLLER (4294967293)
    Actions length: 16
    Pad: 000000000000
    Action
    Data
        Ethernet II, Src: ca:02:05:e6:00:08 (ca:02:05:e6:00:08), Dst: IPv6mcast_ff:e6:00:08 (33:33:ff:e6:00:08)
        Internet Protocol Version 6, Src: ::, Dst: ff02::1:ffe6:8
        Internet Control Message Protocol v6
            Type: Neighbor Solicitation (135)
            Code: 0
            Checksum: 0xae48 [correct]
            [Checksum Status: Good]
            Reserved: 00000000
            Target Address: fe80::c802:5ff:fee6:8
OpenFlow 1.3
    Version: 1.3 (0x04)
    Type: OFPT_PACKET_OUT (13)
    Length: 118
    Transaction ID: 125412
    Buffer ID: OFP_NO_BUFFER (4294967295)
    In port: OFPP_CONTROLLER (4294967293)
    Actions length: 16
    Pad: 000000000000
    Action
    Data
        Ethernet II, Src: ca:02:05:e6:00:08 (ca:02:05:e6:00:08), Dst: IPv6mcast_ff:e6:00:08 (33:33:ff:e6:00:08)
        Internet Protocol Version 6, Src: ::, Dst: ff02::1:ffe6:8
        Internet Control Message Protocol v6
            Type: Neighbor Solicitation (135)
            Code: 0
            Checksum: 0xae48 [correct]
            [Checksum Status: Good]
            Reserved: 00000000
            Target Address: fe80::c802:5ff:fee6:8
OpenFlow 1.3
    Version: 1.3 (0x04)
    Type: OFPT_PACKET_OUT (13)
    Length: 118
    Transaction ID: 125413
    Buffer ID: OFP_NO_BUFFER (4294967295)
    In port: OFPP_CONTROLLER (4294967293)
    Actions length: 16
    Pad: 000000000000
    Action
    Data
        Ethernet II, Src: ca:02:05:e6:00:08 (ca:02:05:e6:00:08), Dst: IPv6mcast_ff:e6:00:08 (33:33:ff:e6:00:08)
        Internet Protocol Version 6, Src: ::, Dst: ff02::1:ffe6:8
        Internet Control Message Protocol v6
            Type: Neighbor Solicitation (135)
            Code: 0
            Checksum: 0xae48 [correct]
            [Checksum Status: Good]
            Reserved: 00000000
            Target Address: fe80::c802:5ff:fee6:8
OpenFlow 1.3
    Version: 1.3 (0x04)
    Type: OFPT_PACKET_OUT (13)
    Length: 118
    Transaction ID: 125414
    Buffer ID: OFP_NO_BUFFER (4294967295)
    In port: OFPP_CONTROLLER (4294967293)
    Actions length: 16
    Pad: 000000000000
    Action
    Data
        Ethernet II, Src: ca:02:05:e6:00:08 (ca:02:05:e6:00:08), Dst: IPv6mcast_ff:e6:00:08 (33:33:ff:e6:00:08)
        Internet Protocol Version 6, Src: ::, Dst: ff02::1:ffe6:8
        Internet Control Message Protocol v6
            Type: Neighbor Solicitation (135)
            Code: 0
            Checksum: 0xae48 [correct]
            [Checksum Status: Good]
            Reserved: 00000000
            Target Address: fe80::c802:5ff:fee6:8
OpenFlow 1.3
    Version: 1.3 (0x04)
    Type: OFPT_PACKET_OUT (13)
    Length: 118
    Transaction ID: 125415
    Buffer ID: OFP_NO_BUFFER (4294967295)
    In port: OFPP_CONTROLLER (4294967293)
    Actions length: 16
    Pad: 000000000000
    Action
    Data
        Ethernet II, Src: ca:02:05:e6:00:08 (ca:02:05:e6:00:08), Dst: IPv6mcast_ff:e6:00:08 (33:33:ff:e6:00:08)
        Internet Protocol Version 6, Src: ::, Dst: ff02::1:ffe6:8
        Internet Control Message Protocol v6
            Type: Neighbor Solicitation (135)
            Code: 0
            Checksum: 0xae48 [correct]
            [Checksum Status: Good]
            Reserved: 00000000
            Target Address: fe80::c802:5ff:fee6:8
OpenFlow 1.3
    Version: 1.3 (0x04)
    Type: OFPT_PACKET_OUT (13)
    Length: 118
    Transaction ID: 125416
    Buffer ID: OFP_NO_BUFFER (4294967295)
    In port: OFPP_CONTROLLER (4294967293)
    Actions length: 16
    Pad: 000000000000
    Action
    Data
        Ethernet II, Src: ca:02:05:e6:00:08 (ca:02:05:e6:00:08), Dst: IPv6mcast_ff:e6:00:08 (33:33:ff:e6:00:08)
        Internet Protocol Version 6, Src: ::, Dst: ff02::1:ffe6:8
        Internet Control Message Protocol v6
            Type: Neighbor Solicitation (135)
            Code: 0
            Checksum: 0xae48 [correct]
            [Checksum Status: Good]
            Reserved: 00000000
            Target Address: fe80::c802:5ff:fee6:8
OpenFlow 1.3
    Version: 1.3 (0x04)
    Type: OFPT_PACKET_OUT (13)
    Length: 118
    Transaction ID: 125417
    Buffer ID: OFP_NO_BUFFER (4294967295)
    In port: OFPP_CONTROLLER (4294967293)
    Actions length: 16
    Pad: 000000000000
    Action
    Data
        Ethernet II, Src: ca:02:05:e6:00:08 (ca:02:05:e6:00:08), Dst: IPv6mcast_ff:e6:00:08 (33:33:ff:e6:00:08)
        Internet Protocol Version 6, Src: ::, Dst: ff02::1:ffe6:8
        Internet Control Message Protocol v6
            Type: Neighbor Solicitation (135)
            Code: 0
            Checksum: 0xae48 [correct]
            [Checksum Status: Good]
            Reserved: 00000000
            Target Address: fe80::c802:5ff:fee6:8
OpenFlow 1.3
    Version: 1.3 (0x04)
    Type: OFPT_PACKET_OUT (13)
    Length: 118
    Transaction ID: 125418
    Buffer ID: OFP_NO_BUFFER (4294967295)
    In port: OFPP_CONTROLLER (4294967293)
    Actions length: 16
    Pad: 000000000000
    Action
    Data
        Ethernet II, Src: ca:02:05:e6:00:08 (ca:02:05:e6:00:08), Dst: IPv6mcast_ff:e6:00:08 (33:33:ff:e6:00:08)
        Internet Protocol Version 6, Src: ::, Dst: ff02::1:ffe6:8
        Internet Control Message Protocol v6
            Type: Neighbor Solicitation (135)
            Code: 0
            Checksum: 0xae48 [correct]
            [Checksum Status: Good]
            Reserved: 00000000
            Target Address: fe80::c802:5ff:fee6:8
OpenFlow 1.3
    Version: 1.3 (0x04)
    Type: OFPT_PACKET_OUT (13)
    Length: 118
    Transaction ID: 125419
    Buffer ID: OFP_NO_BUFFER (4294967295)
    In port: OFPP_CONTROLLER (4294967293)
    Actions length: 16
    Pad: 000000000000
    Action
    Data
        Ethernet II, Src: ca:02:05:e6:00:08 (ca:02:05:e6:00:08), Dst: IPv6mcast_ff:e6:00:08 (33:33:ff:e6:00:08)
        Internet Protocol Version 6, Src: ::, Dst: ff02::1:ffe6:8
        Internet Control Message Protocol v6
            Type: Neighbor Solicitation (135)
            Code: 0
            Checksum: 0xae48 [correct]
            [Checksum Status: Good]
            Reserved: 00000000
            Target Address: fe80::c802:5ff:fee6:8
OpenFlow 1.3
    Version: 1.3 (0x04)
    Type: OFPT_PACKET_OUT (13)
    Length: 118
    Transaction ID: 125420
    Buffer ID: OFP_NO_BUFFER (4294967295)
    In port: OFPP_CONTROLLER (4294967293)
    Actions length: 16
    Pad: 000000000000
    Action
    Data
        Ethernet II, Src: ca:02:05:e6:00:08 (ca:02:05:e6:00:08), Dst: IPv6mcast_ff:e6:00:08 (33:33:ff:e6:00:08)
        Internet Protocol Version 6, Src: ::, Dst: ff02::1:ffe6:8
        Internet Control Message Protocol v6
            Type: Neighbor Solicitation (135)
            Code: 0
            Checksum: 0xae48 [correct]
            [Checksum Status: Good]
